{
  "$schema": "https://json-schema.org/draft/2020-12/schema",
  "$id": "https://agent-pidgin.local/schemas/pidgin-skill-manifest.schema.json",
  "title": "Pidgin OpenClaw-Class Skill Manifest",
  "type": "object",
  "additionalProperties": false,
  "required": [
    "skill_id",
    "name",
    "version",
    "publisher",
    "signed",
    "permissions",
    "capabilities"
  ],
  "properties": {
    "skill_id": {
      "type": "string",
      "pattern": "^[a-zA-Z0-9._-]+(/[a-zA-Z0-9._-]+)?$"
    },
    "name": {
      "type": "string",
      "minLength": 1
    },
    "version": {
      "type": "string",
      "minLength": 1
    },
    "publisher": {
      "type": "object",
      "additionalProperties": false,
      "required": ["id", "name"],
      "properties": {
        "id": {
          "type": "string",
          "minLength": 1
        },
        "name": {
          "type": "string",
          "minLength": 1
        }
      }
    },
    "signed": {
      "type": "boolean"
    },
    "signature": {
      "type": "object",
      "additionalProperties": false,
      "required": ["key_id", "algorithm", "value"],
      "properties": {
        "key_id": {
          "type": "string",
          "minLength": 1
        },
        "algorithm": {
          "type": "string",
          "minLength": 1
        },
        "value": {
          "type": "string",
          "minLength": 1
        }
      }
    },
    "permissions": {
      "type": "array",
      "items": {
        "type": "object",
        "additionalProperties": false,
        "required": ["kind", "target", "access"],
        "properties": {
          "kind": {
            "enum": ["network", "filesystem", "shell", "credential", "browser", "calendar", "email", "memory"]
          },
          "target": {
            "type": "string",
            "minLength": 1
          },
          "access": {
            "enum": ["read", "write", "execute", "send", "install", "admin"]
          },
          "reason": {
            "type": "string"
          }
        }
      }
    },
    "capabilities": {
      "type": "array",
      "items": {
        "type": "string",
        "minLength": 1
      }
    },
    "metadata": {
      "type": "object"
    }
  },
  "allOf": [
    {
      "if": {
        "properties": {
          "signed": {
            "const": true
          }
        },
        "required": ["signed"]
      },
      "then": {
        "required": ["signature"]
      }
    }
  ]
}
